{
  "version": "1.0.0",
  "dialects": {
    "egyptian": {
      "name_ar": "المصرية"
    },
    "levantine": {
      "name_ar": "الشامية"
    },
    "gulf": {
      "name_ar": "الخليجية"
    },
    "iraqi": {
      "name_ar": "العراقية"
    },
    "maghrebi": {
      "name_ar": "المغاربية"
    }
  },
  "entries": [
    {
      "id": "EG_IZZAY",
      "dialects": [
        "egyptian"
      ],
      "forms": [
        "ازاي",
        "إزاي"
      ],
      "msa": "كيف",
      "weight": 1.4,
      "confidence": 0.94,
      "kind": "lexical",
      "explanation": "تعبير لهجي؛ المقابل الفصيح المقترح: «كيف»."
    },
    {
      "id": "EG_DILWAQTI",
      "dialects": [
        "egyptian"
      ],
      "forms": [
        "دلوقتي",
        "دلوقت"
      ],
      "msa": "الآن",
      "weight": 1.5,
      "confidence": 0.96,
      "kind": "lexical",
      "explanation": "تعبير لهجي؛ المقابل الفصيح المقترح: «الآن»."
    },
    {
      "id": "EG_AYIZ",
      "dialects": [
        "egyptian"
      ],
      "forms": [
        "عايز"
      ],
      "msa": "أريد",
      "weight": 1.25,
      "confidence": 0.92,
      "kind": "lexical",
      "explanation": "تعبير لهجي؛ المقابل الفصيح المقترح: «أريد»."
    },
    {
      "id": "EG_AWIZ",
      "dialects": [
        "egyptian"
      ],
      "forms": [
        "عاوز"
      ],
      "msa": "أريد",
      "weight": 1.25,
      "confidence": 0.92,
      "kind": "lexical",
      "explanation": "تعبير لهجي؛ المقابل الفصيح المقترح: «أريد»."
    },
    {
      "id": "EG_AYZA",
      "dialects": [
        "egyptian"
      ],
      "forms": [
        "عايزة",
        "عاوزه"
      ],
      "msa": "أريد",
      "weight": 1.3,
      "confidence": 0.93,
      "kind": "lexical",
      "explanation": "تعبير لهجي؛ المقابل الفصيح المقترح: «أريد»."
    },
    {
      "id": "EG_AYZIN",
      "dialects": [
        "egyptian"
      ],
      "forms": [
        "عايزين",
        "عاوزين"
      ],
      "msa": "نريد",
      "weight": 1.35,
      "confidence": 0.94,
      "kind": "lexical",
      "explanation": "تعبير لهجي؛ المقابل الفصيح المقترح: «نريد»."
    },
    {
      "id": "EG_MAFISH",
      "dialects": [
        "egyptian"
      ],
      "forms": [
        "مفيش"
      ],
      "msa": "لا يوجد",
      "weight": 1.5,
      "confidence": 0.97,
      "kind": "lexical",
      "explanation": "تعبير لهجي؛ المقابل الفصيح المقترح: «لا يوجد»."
    },
    {
      "id": "EG_KIDA",
      "dialects": [
        "egyptian"
      ],
      "forms": [
        "كده",
        "كدا"
      ],
      "msa": "هكذا",
      "weight": 1.2,
      "confidence": 0.92,
      "kind": "lexical",
      "explanation": "تعبير لهجي؛ المقابل الفصيح المقترح: «هكذا»."
    },
    {
      "id": "EG_NAHARDA",
      "dialects": [
        "egyptian"
      ],
      "forms": [
        "النهارده",
        "النهاردة"
      ],
      "msa": "اليوم",
      "weight": 1.5,
      "confidence": 0.96,
      "kind": "lexical",
      "explanation": "تعبير لهجي؛ المقابل الفصيح المقترح: «اليوم»."
    },
    {
      "id": "EG_AWI",
      "dialects": [
        "egyptian"
      ],
      "forms": [
        "أوي",
        "اوي"
      ],
      "msa": "جدًا",
      "weight": 0.9,
      "confidence": 0.88,
      "kind": "lexical",
      "explanation": "تعبير لهجي؛ المقابل الفصيح المقترح: «جدًا»."
    },
    {
      "id": "EG_MISH",
      "dialects": [
        "egyptian",
        "levantine"
      ],
      "forms": [
        "مش"
      ],
      "msa": "ليس",
      "weight": 0.55,
      "confidence": 0.78,
      "kind": "lexical",
      "explanation": "تعبير لهجي؛ المقابل الفصيح المقترح: «ليس»."
    },
    {
      "id": "EG_BARDO",
      "dialects": [
        "egyptian"
      ],
      "forms": [
        "برضه",
        "برضو"
      ],
      "msa": "أيضًا",
      "weight": 1.15,
      "confidence": 0.91,
      "kind": "lexical",
      "explanation": "تعبير لهجي؛ المقابل الفصيح المقترح: «أيضًا»."
    },
    {
      "id": "LV_SHU",
      "dialects": [
        "levantine"
      ],
      "forms": [
        "شو"
      ],
      "msa": "ماذا",
      "weight": 1.15,
      "confidence": 0.91,
      "kind": "lexical",
      "explanation": "تعبير لهجي؛ المقابل الفصيح المقترح: «ماذا»."
    },
    {
      "id": "LV_HEK",
      "dialects": [
        "levantine"
      ],
      "forms": [
        "هيك"
      ],
      "msa": "هكذا",
      "weight": 1.2,
      "confidence": 0.92,
      "kind": "lexical",
      "explanation": "تعبير لهجي؛ المقابل الفصيح المقترح: «هكذا»."
    },
    {
      "id": "LV_HALLAQ",
      "dialects": [
        "levantine"
      ],
      "forms": [
        "هلق"
      ],
      "msa": "الآن",
      "weight": 1.45,
      "confidence": 0.96,
      "kind": "lexical",
      "explanation": "تعبير لهجي؛ المقابل الفصيح المقترح: «الآن»."
    },
    {
      "id": "LV_HALLA",
      "dialects": [
        "levantine"
      ],
      "forms": [
        "هلأ",
        "هلا"
      ],
      "msa": "الآن",
      "weight": 1.1,
      "confidence": 0.88,
      "kind": "lexical",
      "explanation": "تعبير لهجي؛ المقابل الفصيح المقترح: «الآن»."
    },
    {
      "id": "LV_KTIR",
      "dialects": [
        "levantine"
      ],
      "forms": [
        "كتير"
      ],
      "msa": "كثيرًا",
      "weight": 1.25,
      "confidence": 0.93,
      "kind": "lexical",
      "explanation": "تعبير لهجي؛ المقابل الفصيح المقترح: «كثيرًا»."
    },
    {
      "id": "LV_MNIH",
      "dialects": [
        "levantine"
      ],
      "forms": [
        "منيح"
      ],
      "msa": "جيد",
      "weight": 1.35,
      "confidence": 0.94,
      "kind": "lexical",
      "explanation": "تعبير لهجي؛ المقابل الفصيح المقترح: «جيد»."
    },
    {
      "id": "LV_MNIHA",
      "dialects": [
        "levantine"
      ],
      "forms": [
        "منيحة"
      ],
      "msa": "جيدة",
      "weight": 1.35,
      "confidence": 0.94,
      "kind": "lexical",
      "explanation": "تعبير لهجي؛ المقابل الفصيح المقترح: «جيدة»."
    },
    {
      "id": "LV_BADDI",
      "dialects": [
        "levantine"
      ],
      "forms": [
        "بدي"
      ],
      "msa": "أريد",
      "weight": 1.4,
      "confidence": 0.95,
      "kind": "lexical",
      "explanation": "تعبير لهجي؛ المقابل الفصيح المقترح: «أريد»."
    },
    {
      "id": "LV_BADNA",
      "dialects": [
        "levantine"
      ],
      "forms": [
        "بدنا"
      ],
      "msa": "نريد",
      "weight": 1.45,
      "confidence": 0.96,
      "kind": "lexical",
      "explanation": "تعبير لهجي؛ المقابل الفصيح المقترح: «نريد»."
    },
    {
      "id": "LV_BADDAK",
      "dialects": [
        "levantine"
      ],
      "forms": [
        "بدك"
      ],
      "msa": "تريد",
      "weight": 1.25,
      "confidence": 0.92,
      "kind": "lexical",
      "explanation": "تعبير لهجي؛ المقابل الفصيح المقترح: «تريد»."
    },
    {
      "id": "LV_BADKON",
      "dialects": [
        "levantine"
      ],
      "forms": [
        "بدكم",
        "بدكن"
      ],
      "msa": "تريدون",
      "weight": 1.35,
      "confidence": 0.93,
      "kind": "lexical",
      "explanation": "تعبير لهجي؛ المقابل الفصيح المقترح: «تريدون»."
    },
    {
      "id": "LV_BADDO",
      "dialects": [
        "levantine"
      ],
      "forms": [
        "بدو"
      ],
      "msa": "يريد",
      "weight": 1.25,
      "confidence": 0.92,
      "kind": "lexical",
      "explanation": "تعبير لهجي؛ المقابل الفصيح المقترح: «يريد»."
    },
    {
      "id": "LV_BADHA",
      "dialects": [
        "levantine"
      ],
      "forms": [
        "بدها"
      ],
      "msa": "تريد",
      "weight": 1.25,
      "confidence": 0.92,
      "kind": "lexical",
      "explanation": "تعبير لهجي؛ المقابل الفصيح المقترح: «تريد»."
    },
    {
      "id": "LV_LESH",
      "dialects": [
        "levantine",
        "gulf",
        "iraqi"
      ],
      "forms": [
        "ليش"
      ],
      "msa": "لماذا",
      "weight": 0.55,
      "confidence": 0.81,
      "kind": "lexical",
      "explanation": "تعبير لهجي؛ المقابل الفصيح المقترح: «لماذا»."
    },
    {
      "id": "LV_MISHAN",
      "dialects": [
        "levantine"
      ],
      "forms": [
        "مشان"
      ],
      "msa": "من أجل",
      "weight": 1.3,
      "confidence": 0.93,
      "kind": "lexical",
      "explanation": "تعبير لهجي؛ المقابل الفصيح المقترح: «من أجل»."
    },
    {
      "id": "LV_SHWAY",
      "dialects": [
        "levantine",
        "egyptian",
        "gulf",
        "iraqi"
      ],
      "forms": [
        "شوي",
        "شوية"
      ],
      "msa": "قليلًا",
      "weight": 0.48,
      "confidence": 0.78,
      "kind": "lexical",
      "explanation": "تعبير لهجي؛ المقابل الفصيح المقترح: «قليلًا»."
    },
    {
      "id": "LV_MBARIH",
      "dialects": [
        "levantine"
      ],
      "forms": [
        "مبارح"
      ],
      "msa": "أمس",
      "weight": 1.4,
      "confidence": 0.95,
      "kind": "lexical",
      "explanation": "تعبير لهجي؛ المقابل الفصيح المقترح: «أمس»."
    },
    {
      "id": "LV_BUKRA",
      "dialects": [
        "levantine",
        "egyptian",
        "gulf",
        "iraqi"
      ],
      "forms": [
        "بكرا"
      ],
      "msa": "غدًا",
      "weight": 0.48,
      "confidence": 0.78,
      "kind": "lexical",
      "explanation": "تعبير لهجي؛ المقابل الفصيح المقترح: «غدًا»."
    },
    {
      "id": "LV_RAH",
      "dialects": [
        "levantine"
      ],
      "forms": [
        "رح"
      ],
      "msa": "سوف",
      "weight": 1.05,
      "confidence": 0.88,
      "kind": "lexical",
      "explanation": "تعبير لهجي؛ المقابل الفصيح المقترح: «سوف»."
    },
    {
      "id": "GF_WISH",
      "dialects": [
        "gulf"
      ],
      "forms": [
        "وش"
      ],
      "msa": "ماذا",
      "weight": 1.1,
      "confidence": 0.9,
      "kind": "lexical",
      "explanation": "تعبير لهجي؛ المقابل الفصيح المقترح: «ماذا»."
    },
    {
      "id": "GF_WISHLON",
      "dialects": [
        "gulf"
      ],
      "forms": [
        "وشلون"
      ],
      "msa": "كيف",